<?xml version="1.0" encoding="utf-8"?>

<InuSWGraph xmlns:i="http://www.w3.org/2001/XMLSchema-instance" i:schemaLocation="http://www.w3schools.com sw_graph.xsd">
  <Version>1</Version>
  <LIST>
    <function>
      <name>Stream_IR_0</name>
      <type>STREAM_OUT</type>
      <inputs>
        <input>IMAGE_0</input>
      </inputs>
      <params>
        <!-- options: 0 low, 1 medium, 2 high, 3 graph runtime context -->
        <thread_priority>3</thread_priority>
        <numBuffers>5</numBuffers>
        <!-- options: USB_IF0 / USB_IF1 / UART / TCP / UDP / CDC / STUB-->
        <connIdE>TCP</connIdE>
      </params>
    </function>
    <function>
      <name>Stream_RGB_1</name>
      <type>STREAM_OUT</type>
      <inputs>
        <input>IMAGE_4</input>
      </inputs>
      <params>
        <!-- options: 0 low, 1 medium, 2 high, 3 graph runtime context -->
        <thread_priority>3</thread_priority>
        <numBuffers>5</numBuffers>
        <!-- options: USB_IF0 / USB_IF1 / UART / TCP / UDP / CDC / STUB-->
        <connIdE>TCP</connIdE>
      </params>
    </function>
    <function>
      <name>Stream_Depth_0</name>
      <type>STREAM_OUT</type>
      <inputs>
        <input>IMAGE_5</input>
      </inputs>
      <params>
        <!-- options: 0 low, 1 medium, 2 high, 3 graph runtime context -->
        <thread_priority>3</thread_priority>
        <numBuffers>5</numBuffers>
        <!-- options: USB_IF0 / USB_IF1 / UART / TCP / UDP / CDC / STUB-->
        <connIdE>TCP</connIdE>
      </params>
    </function>
    <function>
      <name>Stream_Depth_1</name>
      <type>STREAM_OUT</type>
      <inputs>
        <input>IMAGE_3</input>
      </inputs>
      <params>
        <!-- options: 0 low, 1 medium, 2 high, 3 graph runtime context -->
        <thread_priority>3</thread_priority>	  
        <numBuffers>5</numBuffers>
        <!-- options: USB_IF0 / USB_IF1 / UART / TCP / UDP / CDC / STUB-->
        <connIdE>TCP</connIdE>
      </params>
    </function>
	<function>
      <name>Stream_RGB_1_ISP_0</name>
      <type>STREAM_OUT</type>
      <inputs>
        <input>IMAGE_23</input>
      </inputs>
      <params>
        <thread_priority>3</thread_priority>
        <numBuffers>5</numBuffers>
        <connIdE>TCP</connIdE>
      </params>
    </function>
    <function>
      <name>dpe_pp_0</name>
      <type>DPE_PP</type>
      <inputs>
        <input>IMAGE_5</input>
      </inputs>
      <params>
        <!-- options: 0 low, 1 medium, 2 high, 3 graph runtime context -->
        <thread_priority>0</thread_priority>
     </params>
    </function>
    <data>
      <name>IMAGE_out_dpe_pp</name>
      <type>IMAGE_DATA</type>
      <input>dpe_pp_0</input>
      <source>INU_SOC_CHANNEL_5</source>
      <params>
        <bitsPerPixel>16</bitsPerPixel>
        <format>DISPARITY</format>
        <height>1024</height>
        <width>1024</width>
        <x>0</x>
        <y>0</y>
        <stride>1024</stride>
        <realBitsMask>0</realBitsMask>
        <bufferHeight>1024</bufferHeight>
        <numInterleaveImages>1</numInterleaveImages>
        <interleaveType>2</interleaveType>
	  </params>
    </data>
    <function>
      <name>Stream_Out_dpe_pp</name>
      <type>STREAM_OUT</type>
      <inputs>
        <input>IMAGE_out_dpe_pp</input>
      </inputs>
      <params>
        <!-- options: 0 low, 1 medium, 2 high, 3 graph runtime context -->
        <thread_priority>3</thread_priority>
        <numBuffers>10</numBuffers>
        <!-- options: USB_IF0 / USB_IF1 / UART / TCP / UDP / CDC / STUB-->
        <connIdE>TCP</connIdE>
      </params>
    </function>
  </LIST>
</InuSWGraph>